title,category,py_view,py_download,r_view,r_download,m_view,m_download,description,py_img,r_img,m_img
Basics of working with satellite data,ERDDAP Basics,python/Tutorial1-basics.ipynb,tutorials/python/Tutorial1-basics.ipynb,r/Tutorial1-basics.qmd,tutorials/r/Tutorial1-basics.qmd,matlab/Tutorial1-basics.qmd,tutorials/matlab/Tutorial1-basics.md,"Access and analyze satellite-derived sea surface temperature using ERDDAP and NetCDF-based workflows. This tutorial demonstrates how to locate and subset a satellite SST product in ERDDAP, download gridded NetCDF data, examine its structure, and create basic spatial maps and regional time series. Users work with the NOAA Coral Reef Watch CoralTemp monthly sea surface temperature product to explore coordinate conventions, generate SST maps, compute regional averages, and visualize temporal variability.",tut1_1_py.png::Time series of sea surface temperature in the western North Atlantic Ocean along the US East Coast in 2022. | tut1_2_py.png::Map of the 2022 average sea surface temperature in the western North Atlantic Ocean along the US East Coast.,tut1_1_r.png::Time series of sea surface temperature in the western North Atlantic Ocean along the US East Coast in 2022. | tut1_2_r.png::Map of the 2022 average sea surface temperature in the western North Atlantic Ocean along the US East Coast.,tut1_1_m.png::Time series of sea surface temperature around the Hawaiian Islands in 2018. | tut1_2_m.png::Map of the 2018 average sea surface temperature in the Hawaiian Islands.
Compare time series from different sensors,Time Series & Trend Analysis,python/timeseries_compare_sensors.ipynb,tutorials/python/timeseries_compare_sensors.ipynb,r/Tutorial2-timeseries-compare-sensors.qmd,tutorials.r/Tutorial2-timeseries-compare-sensors.md,matlab/Tutorial2-timeseries-compare-sensors.qmd,tutorials/matlab/Tutorial2-timeseries-compare-sensors.md,"Compare satellite chlorophyll-a time series from multiple ocean color sensors to understand differences during overlapping observation periods. This tutorial demonstrates how to use ERDDAP to extract spatially averaged chlorophyll-a time series from a defined region, examine dataset metadata, handle differences in coordinate conventions, and compare measurements across sensors through visualization. Monthly chlorophyll-a data from SeaWiFS, MODIS Aqua, NOAA VIIRS S-NPP, and the ESA Ocean Colour Climate Change Initiative (OC-CCI) are used to evaluate consistency and variability among sensors from 1997 to the present.","tut2_1_py.png::Monthly chlorophyll-a time series from SeaWiFS, MODIS Aqua, VIIRS S-NPP, and the ESA OC-CCI dataset averaged over a Gulf of Mexico region, illustrating differences among sensors during periods of overlap.","tut2_1_r.png::Monthly chlorophyll-a time series from SeaWiFS, MODIS Aqua, VIIRS S-NPP, and the ESA OC-CCI dataset averaged over a Gulf of Mexico region, illustrating differences among sensors during periods of overlap. | tut2_2_r.png::Mean log-transformed chlorophyll-a concentration for the Gulf of Mexico region derived from SeaWiFS, MODIS Aqua, NOAA VIIRS S-NPP, and the ESA OC-CCI blended dataset.","tut2_1_m.png::Monthly chlorophyll-a time series from SeaWiFS, MODIS Aqua, VIIRS S-NPP, and the ESA OC-CCI dataset averaged over a Gulf of Mexico region, illustrating differences among sensors during periods of overlap. "
Make a virtual buoy with satellite data,Time Series & Trend Analysis,python/create-virtual-buoy-with-satellite-data.ipynb,tutorials/python/create-virtual-buoy-with-satellite-data.ipynb,r/virtual_buoy_example.qmd,tutorials/r/virtual_buoy_example.Rmd,,,"Create a virtual ocean buoy using satellite data to extend or replace discontinued in situ observations. This tutorial demonstrates how to use ERDDAP to extract satellite sea surface temperature at a fixed location, build and clean a virtual buoy time series, resample the data to a lower temporal resolution, and analyze trends through visualization and linear regression. Data from NDBC Buoy 46259 are used alongside the NOAA GeoPolar Blended SST satellite dataset.",vbuoy_py.png::National Data Buoy Center buoy 46259 matched up with sea surface temperature data. | vbuoy2_py.png:: Trend analysis of buoy and satellite data.,vbuoy_r.png::National Data Buoy Center buoy 46259 matched up with sea surface temperature data. | vbuoy2_r.png:: Trend analysis of buoy and satellite data.,
Calculating sea ice area and extent,Spatial Analysis & Mapping,python/calculating-sea-ice-extent.ipynb,tutorials/python/calculating-sea-ice-extent.ipynb,r/calculate-seaice-extent.qmd,tutorials/r/calculate-seaice-extent.Rmd,,,"Calculate sea ice area and extent from satellite-derived sea ice concentration to quantify seasonal and interannual variability in Arctic ice cover. This tutorial demonstrates how to use PolarWatch ERDDAP to retrieve gridded sea ice concentration data, incorporate grid cell area information, and apply standard concentration thresholds to compute sea ice area and extent. Users visualize sea ice concentration maps and generate monthly time series to examine changes in Arctic sea ice over time. Data from the NOAA/NSIDC Sea Ice Concentration Climate Data Record (Version 4) and a polar stereographic grid cell area dataset are used to perform the calculations for the Northern Hemisphere.",seaice1_py.png::Monthly mean sea ice concentration in the Northern Hemisphere derived from the NOAA/NSIDC Sea Ice Concentration Climate Data Record. | seaice2_py.png::Monthly time series of Arctic sea ice area and sea ice extent computed from satellite-derived sea ice concentration using a 15% concentration threshold.,seaice1_r.png::Monthly mean sea ice concentration for the Arctic in 2021 shown in a Northern Polar Stereographic projection. | seaice2_r.png::Monthly time series of Arctic sea ice area and sea ice extent for 2021 computed from satellite-derived sea ice concentration using a 15% concentration threshold.,
Working with data that crosses the antimeridian,Spatial Analysis & Mapping,python/convert-180+180-to-0-360-longitude.ipynb,tutorials/python/convert-180+180-to-0-360-longitude.ipynb,,,,,"Work with satellite datasets that span the antimeridian by correcting longitude discontinuities for analysis and visualization. This tutorial demonstrates how to retrieve gridded satellite data defined on a −180° to +180° longitude system, subset regions that cross the antimeridian, convert longitude coordinates to a 0–360° system, and reorder the longitude axis to create a continuous spatial domain. The corrected data are then visualized on a map and saved for downstream analysis. Chlorophyll-a data from the NOAA gap-filled blended VIIRS ocean color dataset are used to illustrate antimeridian handling in the Bering Sea region.","convert1801_py.png::Subset of satellite chlorophyll-a data crossing the antimeridian plotted using a −180° to +180° longitude convention. The map shows a visible discontinuity where data from opposite sides of the antimeridian are split and displayed at opposite edges of the domain. | convert1802_py.png::The same satellite chlorophyll-a data after converting longitudes to a 0–360° convention and reordering the longitude axis. The antimeridian discontinuity is removed, resulting in a continuous spatial representation suitable for mapping and analysis.",,
Define a marine habitat,Spatial Analysis & Mapping,python/define_marine_habitat.ipynb,tutorials/python/define_marine_habitat.ipynb,r/define_marine_habitat.qmd,tutorials/r/define_marine_habitat.Rmd,,,"Define a marine habitat using satellite sea surface temperature to identify regions associated with species–environment interactions. This tutorial demonstrates how to retrieve satellite SST from ERDDAP, subset data for a region and time of interest, and apply temperature-based thresholds to delineate a habitat band. The resulting temperature contours are visualized on a map to highlight areas associated with increased likelihood of interaction. Sea surface temperature data from the NOAA Coral Reef Watch CoralTemp product are used to illustrate habitat definition in the central North Pacific as part of the TurtleWatch framework.","marine1_py.png::Satellite sea surface temperature map with the TurtleWatch habitat band highlighted. The red band marks SST values between 17.5 °C and 18.5 °C, identifying regions associated with increased loggerhead sea turtle interactions based on the TurtleWatch framework.","marine1_r.png::Satellite sea surface temperature map with the TurtleWatch habitat band highlighted. The red band marks SST values between 17.5 °C and 18.5 °C, identifying regions associated with increased loggerhead sea turtle interactions based on the TurtleWatch framework.",